{
  "schema_version": "open-education-clear-reasoning/source-packet-index/v1",
  "repo_id": "open-education-clear-reasoning",
  "last_reviewed": "2026-06-14",
  "policy": {
    "source_text_copied": false,
    "excerpt_use_requires_packet_approval": true,
    "western_packets_support_original_lessons": true,
    "comparative_packets_require_cultural_review": true
  },
  "summary": {
    "western_packets": 5,
    "comparative_candidate_packets": 6,
    "original_lesson_allowed": 5,
    "excerpt_use_allowed": 0,
    "needs_cultural_review": 6
  },
  "packets": [
    {
      "id": "euclid-elements-casey",
      "source_id": "euclid-elements",
      "path": "source-packets/western/euclid-elements-casey.md",
      "category": "western",
      "work": "The First Six Books of the Elements of Euclid",
      "author": "Euclid; edited and annotated by John Casey",
      "review_status": "approved_for_original_lesson",
      "rights_status": "public_domain_usa_source_page_checked",
      "source_reference": "https://www.gutenberg.org/ebooks/21076",
      "original_lesson_allowed": true,
      "excerpt_use_allowed": false,
      "needs_cultural_review": false,
      "lesson_refs": [
        "study-plans/western-spine-lessons/LESSON_OUTLINES.md#euclidean-proof-craft"
      ]
    },
    {
      "id": "aristotle-categories-edghill",
      "source_id": "aristotle-categories",
      "path": "source-packets/western/aristotle-categories-edghill.md",
      "category": "western",
      "work": "The Categories",
      "author": "Aristotle; translated by E. M. Edghill",
      "review_status": "approved_for_original_lesson",
      "rights_status": "public_domain_usa_source_page_checked",
      "source_reference": "https://www.gutenberg.org/ebooks/2412",
      "original_lesson_allowed": true,
      "excerpt_use_allowed": false,
      "needs_cultural_review": false,
      "lesson_refs": [
        "study-plans/western-spine-lessons/LESSON_OUTLINES.md#aristotelian-categories-and-definitions"
      ]
    },
    {
      "id": "aristotle-prior-analytics-owen",
      "source_id": "aristotle-prior-analytics",
      "path": "source-packets/western/aristotle-prior-analytics-owen.md",
      "category": "western",
      "work": "Prior Analytics within The Organon, or Logical Treatises of Aristotle",
      "author": "Aristotle; translated by Octavius Freire Owen",
      "review_status": "approved_for_original_lesson",
      "rights_status": "publication_date_public_domain_candidate_checked",
      "source_reference": "https://archive.org/details/organonorlogicalt01aris",
      "original_lesson_allowed": true,
      "excerpt_use_allowed": false,
      "needs_cultural_review": false,
      "lesson_refs": [
        "study-plans/western-spine-lessons/LESSON_OUTLINES.md#syllogism-and-valid-inference"
      ]
    },
    {
      "id": "aristotle-rhetoric-cope-sandys",
      "source_id": "aristotle-rhetoric",
      "path": "source-packets/western/aristotle-rhetoric-cope-sandys.md",
      "category": "western",
      "work": "The Rhetoric of Aristotle",
      "author": "Aristotle; translated by Edward Meredith Cope; John Edwin Sandys",
      "review_status": "approved_for_original_lesson",
      "rights_status": "publication_date_public_domain_candidate_checked",
      "source_reference": "https://archive.org/details/rhetoricaristot09sandgoog",
      "original_lesson_allowed": true,
      "excerpt_use_allowed": false,
      "needs_cultural_review": false,
      "lesson_refs": [
        "study-plans/western-spine-lessons/LESSON_OUTLINES.md#ethical-rhetoric-and-audience"
      ]
    },
    {
      "id": "plato-apology-jowett",
      "source_id": "plato-dialogues",
      "path": "source-packets/western/plato-apology-jowett.md",
      "category": "western",
      "work": "Apology",
      "author": "Plato; translated by Benjamin Jowett",
      "review_status": "approved_for_original_lesson",
      "rights_status": "public_domain_usa_source_page_checked",
      "source_reference": "https://www.gutenberg.org/ebooks/1656",
      "original_lesson_allowed": true,
      "excerpt_use_allowed": false,
      "needs_cultural_review": false,
      "lesson_refs": [
        "study-plans/western-spine-lessons/LESSON_OUTLINES.md#socratic-questioning-under-pressure"
      ]
    },
    {
      "id": "indian-nyaya-sutras-candidate",
      "source_id": "indian-nyaya-candidate",
      "path": "source-packets/comparative/indian-nyaya-sutras-candidate.md",
      "category": "comparative",
      "work": "The Nyaya Sutras of Gotama",
      "author": "Gautama/Aksapada Gautama; translation candidate by Satisa Chandra Vidyabhusana",
      "review_status": "needs_cultural_review",
      "rights_status": "candidate_needs_review",
      "source_reference": "https://archive.org/details/in.ernet.dli.2015.281073",
      "original_lesson_allowed": false,
      "excerpt_use_allowed": false,
      "needs_cultural_review": true,
      "lesson_refs": []
    },
    {
      "id": "buddhist-logic-candidate",
      "source_id": "buddhist-logic-candidate",
      "path": "source-packets/comparative/buddhist-logic-candidate.md",
      "category": "comparative",
      "work": "Buddhist Logic candidate materials",
      "author": "Candidate secondary/source tradition around Dignaga, Dharmakirti, and later interpreters",
      "review_status": "needs_cultural_review",
      "rights_status": "candidate_needs_review",
      "source_reference": "https://archive.org/search?query=%22Buddhist%20Logic%22%20Stcherbatsky",
      "original_lesson_allowed": false,
      "excerpt_use_allowed": false,
      "needs_cultural_review": true,
      "lesson_refs": []
    },
    {
      "id": "islamic-ghazali-deliverance-candidate",
      "source_id": "islamic-reasoning-candidate",
      "path": "source-packets/comparative/islamic-ghazali-deliverance-candidate.md",
      "category": "comparative",
      "work": "Deliverance from Error / al-Munqidh min al-Dalal candidate materials",
      "author": "Abu Hamid al-Ghazali",
      "review_status": "needs_cultural_review",
      "rights_status": "candidate_needs_review",
      "source_reference": "https://archive.org/details/AlGhazaliMunkidhMinAlDalalDeliveranceFromError",
      "original_lesson_allowed": false,
      "excerpt_use_allowed": false,
      "needs_cultural_review": true,
      "lesson_refs": []
    },
    {
      "id": "jewish-pirke-avot-candidate",
      "source_id": "jewish-legal-philosophical-candidate",
      "path": "source-packets/comparative/jewish-pirke-avot-candidate.md",
      "category": "comparative",
      "work": "Pirke Avot: The Sayings of the Jewish Fathers",
      "author": "Pirke Avot tradition; translation candidate by Joseph I. Gorfinkle",
      "review_status": "needs_cultural_review",
      "rights_status": "public_domain_usa_source_page_checked_but_cultural_review_needed",
      "source_reference": "https://www.gutenberg.org/ebooks/8547",
      "original_lesson_allowed": false,
      "excerpt_use_allowed": false,
      "needs_cultural_review": true,
      "lesson_refs": []
    },
    {
      "id": "chinese-confucian-analects-candidate",
      "source_id": "confucius-analects",
      "path": "source-packets/comparative/chinese-confucian-analects-candidate.md",
      "category": "comparative",
      "work": "The Chinese Classics, Volume 1: Confucian Analects",
      "author": "Confucius tradition; translated by James Legge",
      "review_status": "needs_cultural_review",
      "rights_status": "public_domain_usa_source_page_checked_but_cultural_review_needed",
      "source_reference": "https://www.gutenberg.org/ebooks/4094",
      "original_lesson_allowed": false,
      "excerpt_use_allowed": false,
      "needs_cultural_review": true,
      "lesson_refs": []
    },
    {
      "id": "african-oral-deliberation-candidate",
      "source_id": "african-oral-deliberative-candidate",
      "path": "source-packets/comparative/african-oral-deliberation-candidate.md",
      "category": "comparative",
      "work": "African Proverbs and Riddles candidate materials",
      "author": "Candidate compilation/research source; exact culturally grounded source to verify",
      "review_status": "needs_cultural_review",
      "rights_status": "candidate_needs_review",
      "source_reference": "https://archive.org/details/pub-domain-african-proverbs",
      "original_lesson_allowed": false,
      "excerpt_use_allowed": false,
      "needs_cultural_review": true,
      "lesson_refs": []
    }
  ]
}
